{
  "attachments": [],
  "base_revision_id": "rev_01J6NE39040000000000000004",
  "blocks": [
    {
      "attachment_ids": [],
      "character_cue_id": null,
      "dialogue_pair_id": null,
      "dual_dialogue_group_id": null,
      "id": "blk_01J6NE39090000000000000009",
      "is_boneyard": false,
      "is_continued": false,
      "is_dual_dialogue": false,
      "is_extension": false,
      "is_forced": false,
      "kind": "title_page_element",
      "note_ids": [],
      "production_tag_ids": [],
      "revision_mark_ids": [],
      "scene_id": null,
      "scene_number": null,
      "schema_version": "1.0",
      "spans": [],
      "text": "THE LOCK",
      "unknown_extensions": {}
    },
    {
      "attachment_ids": [],
      "character_cue_id": null,
      "dialogue_pair_id": null,
      "dual_dialogue_group_id": null,
      "id": "blk_01J6NE390A000000000000000A",
      "is_boneyard": false,
      "is_continued": false,
      "is_dual_dialogue": false,
      "is_extension": false,
      "is_forced": false,
      "kind": "title_page_element",
      "note_ids": [],
      "production_tag_ids": [],
      "revision_mark_ids": [],
      "scene_id": null,
      "scene_number": null,
      "schema_version": "1.0",
      "spans": [],
      "text": "Written by Jordan Hale",
      "unknown_extensions": {}
    },
    {
      "attachment_ids": [],
      "character_cue_id": null,
      "dialogue_pair_id": null,
      "dual_dialogue_group_id": null,
      "id": "blk_01J6NE390B000000000000000B",
      "is_boneyard": false,
      "is_continued": false,
      "is_dual_dialogue": false,
      "is_extension": false,
      "is_forced": false,
      "kind": "scene_heading",
      "note_ids": [],
      "production_tag_ids": [],
      "revision_mark_ids": [],
      "scene_id": "scn_01J6NE39060000000000000006",
      "scene_number": "1",
      "schema_version": "1.0",
      "spans": [],
      "text": "INT. KITCHEN - DAY",
      "unknown_extensions": {}
    },
    {
      "attachment_ids": [],
      "character_cue_id": null,
      "dialogue_pair_id": null,
      "dual_dialogue_group_id": null,
      "id": "blk_01J6NE390C000000000000000C",
      "is_boneyard": false,
      "is_continued": false,
      "is_dual_dialogue": false,
      "is_extension": false,
      "is_forced": false,
      "kind": "action",
      "note_ids": [],
      "production_tag_ids": [],
      "revision_mark_ids": [],
      "scene_id": "scn_01J6NE39060000000000000006",
      "scene_number": null,
      "schema_version": "1.0",
      "spans": [],
      "text": "Ada studies the lock.",
      "unknown_extensions": {}
    },
    {
      "attachment_ids": [],
      "character_cue_id": "cue_01J6NE39070000000000000007",
      "dialogue_pair_id": "dlg_01J6NE39080000000000000008",
      "dual_dialogue_group_id": null,
      "id": "blk_01J6NE390D000000000000000D",
      "is_boneyard": false,
      "is_continued": false,
      "is_dual_dialogue": false,
      "is_extension": false,
      "is_forced": false,
      "kind": "character",
      "note_ids": [],
      "production_tag_ids": [],
      "revision_mark_ids": [],
      "scene_id": "scn_01J6NE39060000000000000006",
      "scene_number": null,
      "schema_version": "1.0",
      "spans": [],
      "text": "ADA",
      "unknown_extensions": {}
    },
    {
      "attachment_ids": [],
      "character_cue_id": null,
      "dialogue_pair_id": "dlg_01J6NE39080000000000000008",
      "dual_dialogue_group_id": null,
      "id": "blk_01J6NE390E000000000000000E",
      "is_boneyard": false,
      "is_continued": false,
      "is_dual_dialogue": false,
      "is_extension": false,
      "is_forced": false,
      "kind": "parenthetical",
      "note_ids": [],
      "production_tag_ids": [],
      "revision_mark_ids": [],
      "scene_id": "scn_01J6NE39060000000000000006",
      "scene_number": null,
      "schema_version": "1.0",
      "spans": [],
      "text": "quietly",
      "unknown_extensions": {}
    },
    {
      "attachment_ids": [],
      "character_cue_id": null,
      "dialogue_pair_id": "dlg_01J6NE39080000000000000008",
      "dual_dialogue_group_id": null,
      "id": "blk_01J6NE390F000000000000000F",
      "is_boneyard": false,
      "is_continued": false,
      "is_dual_dialogue": false,
      "is_extension": false,
      "is_forced": false,
      "kind": "dialogue",
      "note_ids": [],
      "production_tag_ids": [],
      "revision_mark_ids": [],
      "scene_id": "scn_01J6NE39060000000000000006",
      "scene_number": null,
      "schema_version": "1.0",
      "spans": [],
      "text": "It's not locked.",
      "unknown_extensions": {}
    },
    {
      "attachment_ids": [],
      "character_cue_id": null,
      "dialogue_pair_id": null,
      "dual_dialogue_group_id": null,
      "id": "blk_01J6NE390G000000000000000G",
      "is_boneyard": false,
      "is_continued": false,
      "is_dual_dialogue": false,
      "is_extension": false,
      "is_forced": false,
      "kind": "transition",
      "note_ids": [],
      "production_tag_ids": [],
      "revision_mark_ids": [],
      "scene_id": "scn_01J6NE39060000000000000006",
      "scene_number": null,
      "schema_version": "1.0",
      "spans": [],
      "text": "CUT TO:",
      "unknown_extensions": {}
    }
  ],
  "id": "doc_01J6NE39030000000000000003",
  "notes": [
    {
      "author_actor_id": "act_01J6NE39010000000000000001",
      "block_id": "blk_01J6NE390B000000000000000B",
      "created_at": "2026-09-01T00:00:00Z",
      "id": "note_01J6NE390H000000000000000H",
      "resolved": false,
      "schema_version": "1.0",
      "text": "Keep the kitchen practical."
    }
  ],
  "paper_size": "us_letter",
  "production_tags": [],
  "project_id": "proj_01J6NE39020000000000000002",
  "revision_marks": [],
  "schema_version": "1.0",
  "sequences": [
    {
      "id": "seq_01J6NE39050000000000000005",
      "order": 0,
      "scene_ids": [
        "scn_01J6NE39060000000000000006"
      ],
      "schema_version": "1.0",
      "title": "Cold Open"
    }
  ],
  "style": "standard_screenplay",
  "title": "The Lock"
}
